First Author,Year,Title,Outcome,Hedge's g,Standard Error,Variance,Lower Limit (95% CI),Upper Limit (95% CI)
Fukuoka et al,2019,Short- and long-term effects of a mobile phone app in conjunction with brief in-person counseling on physical activity among physically inactive women: the mPED randomized clinical trial,Daily step counts,0.401,0.170,0.029,0.068,0.734
Gonze et al,2020,Use of a smartphone app to increase physical activity levels in insufficiently active adults: feasibility sequential multiple assignment randomized trial (SMART),Daily step counts,-0.075,0.541,0.292,-1.135,0.985
Patel et al,2019,Effectiveness of behaviorally designed gamification interventions with social incentives for increasing physical activity among overweight and obese adults across the United States,Daily step counts,0.418,0.116,0.014,0.190,0.645
Zhou et al,2018a,Evaluating machine learning-based automated personalized daily step goals delivered through a mobile phone app: randomized controlled trial,Daily step counts,0.419,0.524,0.275,-0.608,1.446
Zhou et al,2018b,Personalizing mobile fitness apps using reinforcement learning,Daily step counts,0.431,0.250,0.063,-0.059,0.922
Fixed,,,,0.402,0.087,0.008,0.231,0.573
Random,,,,0.402,0.087,0.008,0.231,0.573
